"id","title","description1","description2","description3","categoryName"
"f8484db4-7abe-4153-a2c0-3179076a0373","Software Engineer","Design and develop software","Troubleshoot and debug issues","Collaborate with cross-functional teams","Web Development"
"a7203cb0-aa06-4cd4-a751-91ba16d3d3d5","Data Analyst","Collect and analyze data","Generate and present reports","Use statistical tools for data interpretation","Artificial Intelligence and Machine Learning"
"9c366bbd-111c-4a7c-a435-c0cf2869e3cb","Graphic Designer","Create visual content","Design marketing materials","Ensure brand consistency","Creative and Media"
"1674dffa-6d9d-4616-a799-e9c8fd279a76","Marketing Specialist","Develop and execute marketing campaigns","Conduct market research","Optimize content for SEO","Sales and Marketing"
"1499e311-e553-4452-a291-84a94f2d3f0c","Project Manager","Plan and oversee projects","Manage project timelines","Coordinate with stakeholders","Project Management"
"5ed1b176-c14d-4437-b597-0f26cd16bcb5","HR Specialist","Recruit and onboard employees","Maintain employee records","Develop and implement HR policies","Human Resources and Recruiting"
"f94d24cb-8aa9-4b58-b3c3-ed0a18fb75a3","SEO Specialist","Optimize website content","Conduct keyword research","Monitor and analyze SEO metrics","Sales and Marketing"
